,Authors,Citations,Date,Full Text Available,Journal,Stats,Summary,Title,Journals,First Author
364,"P Wang, S Xu, Z Li, J Yang, C Zhang, H Zheng",53,2015,[PDF] nsfc.gov.cn,Materials Science and …,"P Wang, S Xu, Z Li, J Yang, C Zhang, H Zheng… - Materials Science and …, 2015 - Elsevier","… [6] found that the strain-rate effect of an open-cell aluminum foam … aluminum matrix could be rate
insensitive, but the foam samples might be rate sensitive due to the cell-structures … the rear-end
polymer foam was taken as Taylor cylinder which was fired to strike a long metal bar …",Experimental investigation on the strain-rate effect and inertia effect of closed-cell aluminum foam subjected to dynamic loading,Materials Science and …,P Wang
365,"K Hooman, A Tamayol",28,2012,No,Journal of …,"K Hooman, A Tamayol… - Journal of …, 2012 - … .asmedigitalcollection.asme.org",2,Impact of particulate deposition on the thermohydraulic performance of metal foam heat exchangers: a simplified theoretical model,Journal of …,K Hooman
366,"A Liebscher, C Redenbac",24,2013,[PDF] ias-iss.org,Image Analysis & Stereology,"A Liebscher, C Redenbach - Image Analysis & Stereology, 2013 - ias-iss.org","… In this work we are interested in so-called open cell foams which are formed by a continuous
network of struts. The macroscopic properties of a foam such as thermal conductivity, permeability,
elasticity or acoustic absorption are highly influenced by the microstructure …",Statistical analysis of the local strut thickness of open cell foams,Image Analysis & Stereology,A Liebscher
367,"K Nawaz, J Bock, Z Dai, AM Jacob",23,2010,[PDF] purdue.edu,201,"K Nawaz, J Bock, Z Dai, AM Jacobi - 2010 - docs.lib.purdue.edu","… Open-cell metal foams have high specific surface area, relatively high thermal conductivity, and
a tortuous flow path to promote mixing. Metal foam have been studies by a number of researchers
for thermal applications; some were focused on metal-foam heat exchangers (and …",[PDF][PDF] Experimental studies to evaluate the use of metal foams in highly compact air-cooling heat exchangers,,K Nawaz
368,"R Singh, HS Kasan",167,2004,No,Applied thermal engineering,"R Singh, HS Kasana - Applied thermal engineering, 2004 - Elsevier","… KavianyPrinciples of Heat Transfer in Porous Media. Springer, New York (1991). [10] VV Calmidi,
Transport phenomena in high porosity metal foams, Ph.D … 303-326. [14] AD Sullins, K. Daryabeigi,
Effective thermal conductivity of high porosity open cell nickel foam, in: 35th …",Computational aspects of effective thermal conductivity of highly porous metal foams,Applied thermal engineering,R Singh
369,"Y Hangai, K Zushida, H Fujii, R Ueji",32,2013,[PDF] core.ac.uk,Materials Science and …,"Y Hangai, K Zushida, H Fujii, R Ueji… - Materials Science and …, 2013 - Elsevier","… be clearly observed, which is almost similar to those of other typical metal foams as reported … a
higher plateau stress but a narrower plateau region than the high-porosity Cu foam … This
deformation behavior under compression was similar to that of open-cell Cu foam obtained by …",Friction powder compaction process for fabricating open-celled Cu foam by sintering-dissolution process route using NaCl space holder,Materials Science and …,Y Hangai
370,"G Tondi, V Fierro, A Pizzi, A Celzar",156,2009,[PDF] academia.edu,Carbon,"G Tondi, V Fierro, A Pizzi, A Celzard - Carbon, 2009 - Elsevier","… reported for microcellular metals. High-porosity open-celled metal foams indeed
have long thin struts (ligaments) connecting at nodes, whereas closed-cell ones
possess spherical non-connected bubbles. In the present case …",Tannin-based carbon foams,Carbon,G Tondi
371,"N Dukhan, R Pic",42,2006,No,eliciano,"N Dukhan, R Picón-Feliciano… - Journal of …, 2006 - … .asmedigitalcollection.asme.org",2,Air flow through compressed and uncompressed aluminum foam: measurements and correlations,Journal of …,N Dukhan
372,"S Kishimoto, Q Wang, Y Tanaka, Y Kagaw",21,2014,No,Composites Part B …,"S Kishimoto, Q Wang, Y Tanaka, Y Kagawa - Composites Part B …, 2014 - Elsevier","… Researchers have carried out some investigations on the properties of metal foam–polymer
composites. Reinfried et al. [11] fabricated hybrid foams by combining expandable polystyrene
with open-cell steel foams and investigated their compressive and damping properties …",Compressive mechanical properties of closed-cell aluminum foam–polymer composites,Composites Part B …,S Kishimoto
373,"S Cunsolo, R Coquard, D Baillis, WKS Chiu",16,2017,No,International Journal of …,"S Cunsolo, R Coquard, D Baillis, WKS Chiu… - International Journal of …, 2017 - Elsevier","… foams are used as efficient insulating materials [1], [2], [3], [4]. Metal or ceramic … on well-known
generation methods and approximate the structures of real foam reasonably well [36 … that allows
the generation of polygonal mesh to represent high porosity open cell foams with high …",Radiative properties of irregular open cell solid foams,International Journal of …,S Cunsolo
374,"AM Matz, BS Mocker, DW Müller, N Jost",18,2014,[PDF] hindawi.com,Advances in Materials …,"AM Matz, BS Mocker, DW Müller, N Jost… - Advances in Materials …, 2014 - hindawi.com","… The metallurgical processing of the open-pore metal foam is carried out by centrifugal casting …
2.4. Mesostructural Characterization. The mesostructure of open-pore foams includes the
geometric parameters of the foam-like structure such as strut width and cell diameter and …",Mesostructural design and manufacturing of open-pore metal foams by investment casting,Advances in Materials …,AM Matz
375,"J Yu, E Wang, J Li, Z Zhen",95,2008,[PDF] ustc.edu.cn,International Journal of Impact Engineering,"J Yu, E Wang, J Li, Z Zheng - International Journal of Impact Engineering, 2008 - Elsevier","… As a new multi-function engineering material, aluminum foams have many useful properties such …
data are available for the low-velocity impact behavior of metal foam core sandwich … the impact
behavior and failure mechanism of aluminum face sheet/open-cell aluminum-foam …",Static and low-velocity impact behavior of sandwich beams with closed-cell aluminum-foam core in three-point bending,International Journal of Impact Engineering,J Yu
376,"M Alizadeh, M Mirza",53,2012,No,liabad,"M Alizadeh, M Mirzaei-Aliabadi - Materials & Design, 2012 - Elsevier","… The most common metal which was selected for energy absorption applications is aluminum
and its alloys due to their light weight and the excellent corrosion resistance [5], [6], [7] … Naiqin
et al. [17] synthesized open cell aluminum foams … Yu et al. [25] produced closed cell AlSi 9 …",Compressive properties and energy absorption behavior of Al–Al2O3 composite foam synthesized by space-holder technique,Materials & Design,M Alizadeh
377,"H Bafti, A Habibolahzade",34,1980,No,Materials & Design (19,"H Bafti, A Habibolahzadeh - Materials & Design (1980-2015), 2013 - Elsevier","… It was shown that mechanical behavior of different density foams varies between those of open-
and closed-cell foam as relative … (6) The mechanical properties of metal foams with almost spherical
cells (ie, those with near-ideal morphologies) fairly approach the predicted …",Compressive properties of aluminum foam produced by powder-Carbamide spacer route,Materials & Design (1980-2015),H Bafti
378,"M Gauthier, LP Lefebvre, Y Thomas",27,2004,No,Materials and …,"M Gauthier, LP Lefebvre, Y Thomas… - Materials and …, 2004 - Taylor & Franci","… The resulting material has an open cell microstructure with three levels of porosity …
Key Words: Metallic foam; Porous metal; Ni; Porous Ni; Nickel foams; Powder
metallurgy; Porosity; Surface area; Mechanical properties; Sintering …",Production of metallic foams having open porosity using a powder metallurgy approach,Materials and …,M Gauthier
379,"JF Rakow, AM Waa",34,2005,[PDF] umich.edu,Journal of spacecraft and rockets,"JF Rakow, AM Waas - Journal of spacecraft and rockets, 2005 - arc.aiaa.org","… Figure 3 shows an open-cell metal foam in detail. In previous studies, the present au- thors have
demonstrated and characterized the response of metal foams under shear loading through
experimentation,4 numerical simulation,5 and a micromechanics-based analysis.6 Metal …",Thermal buckling of metal foam sandwich panels for convective thermal protection systems,Journal of spacecraft and rockets,JF Rakow
380,RS Lake,99,1987,No,US Patent 4,"RS Lakes - US Patent 4,668,557, 1987 - Google Patent","… For example, an open-cell metallic foam might be used as a starting material for the transformation
process. The temperature required for the transformation of a metallic foam could be expected
to be a significant fraction of the melting temperature for the metal …",Polyhedron cell structure and method of making same,"US Patent 4,668,557",
381,"AN Leonov, OL Smorygo, VK Shele",20,1997,[PDF] researchgate.net,Reaction Kinetics and Catalysis …,"AN Leonov, OL Smorygo, VK Sheleg - Reaction Kinetics and Catalysis …, 1997 - Springer","… At Powder Metallurgy Research Institute, Minsk, techniques for production of highly-porous foam
materials by duplicating the structure of the open-cell polyurethane foam (PF) have been
developed. 1. Metal foam (MF) is produced by electrochemical deposition …",Monolithic catalyst supports with foam structure,Reaction Kinetics and Catalysis …,AN Leonov
382,"DA Ramirez, LE Murr, SJ Li, YX Tian, E Martinez",120,2011,No,Materials Science and …,"DA Ramirez, LE Murr, SJ Li, YX Tian, E Martinez… - Materials Science and …, 2011 - Elsevier","… The sample design for open cellular structures fabricated in this study (Fig. 2) followed
the general metal foam requirements described by Ashby et al. [2]: height/width >1.5,
height >7 times the cell size, pore size, or open channel size …",Open-cellular copper structures fabricated by additive manufacturing using electron beam melting,Materials Science and …,DA Ramirez
383,"CG Lee, MK Song, JC Ryu, C Park, JW Choi, SH Le",38,2016,No,Chemosphere,"CG Lee, MK Song, JC Ryu, C Park, JW Choi, SH Lee - Chemosphere, 2016 - Elsevier","… this study was 88.97%, indicating that the major part of the pore network was open and connected …
All three types of cell lines showed more than 80% cell survival in the process … Javanbakht et al.,
2014 V. Javanbakht, SA Alavi, H. ZiloueiMechanisms of heavy metal removal using …",Application of carbon foam for heavy metal removal from industrial plating wastewater and toxicity evaluation of the adsorbent,Chemosphere,CG Lee
384,"Q Pang, GH Wu, ZY Xiu, LT Jiang, DL Su",17,2012,No,Materials Characterization,"Q Pang, GH Wu, ZY Xiu, LT Jiang, DL Sun - Materials Characterization, 2012 - Elsevier","… [6] produced open-cell foams with Inconel 625 composition by electron beam directed vapor
deposition (with relative densities of < 3%), but no oxidation behavior were investigated. Chyrkin
et al. [7] prepared Inconel 625 metal foams by the slip-reaction-foam-sinter-process and …","Microstructure, oxidation resistance and high-temperature strength of a new class of 3D open‐cell nickel-based foams",Materials Characterization,Q Pang
385,"P De Jaeger, C T'Joen, H Huisseune",14,2013,[DOC] ugent.be,Heat Transfer …,"P De Jaeger, C T'Joen, H Huisseune… - Heat Transfer …, 2013 - Taylor & Franci","… structure is called a “wet” foam, and a “dry” foam otherwise [6]. The foaming process is … foam is
commonly used as preform for repro- duction of other material open-cell foams, such as of … a heat
transfer point of view, the main difference in the resulting open-cell metal foam is that …",Influence of geometrical parameters of open-cell aluminum foam on thermohydraulic performance,Heat Transfer …,P De Jaeger
386,"AJ Onstad, CJ Elkins, F Medina, RB Wicker",23,2011,No,Experiments in fluids,"AJ Onstad, CJ Elkins, F Medina, RB Wicker… - Experiments in fluids, 2011 - Springer","… and eight hexagons. This structure also looks similar to published pictures of
open-cell metal foams. A full numerical calculation was performed to determine the
flow characteristics within their foam geometry. These works are …",Full-field measurements of flow through a scaled metal foam replica,Experiments in fluids,AJ Onstad
387,"M Vesenjak, M Borovinšek, T Fiedler, Y Higa, Z Re",35,2013,No,Materials letters,"M Vesenjak, M Borovinšek, T Fiedler, Y Higa, Z Ren - Materials letters, 2013 - Elsevier","… can be explained by the manufacturing procedure (heat reaction of the foaming agent) … M. Avalle,
et al.Mechanical Characterization of Particulate Aluminum Foams – Strain-Rate … T. FiedlerAnalysis
of anisotropy and strain rate sensitivity of open-cell metal foam. Materials Science …",Structural characterisation of advanced pore morphology (APM) foam elements,Materials letters,M Vesenjak
388,"MH Luxner, J Stampfl, HE Petterman",96,2005,[PDF] researchgate.net,Journal of Materials science,"MH Luxner, J Stampfl, HE Pettermann - Journal of Materials science, 2005 - Springer","… studying cellular structures. Analytical methods [5] and Finite Element simulations
based on beam elements [6] are used for analyzing the effective stiffness of open
cell metal- lic foams with tetrakaidecahedral unit cells. In [6] a …",Finite element modeling concepts and linear analyses of 3D regular open cell structures,Journal of Materials science,MH Luxner
389,"L Yang, D Cormier, H West, O Harrysson",46,2012,No,Materials Science and …,"L Yang, D Cormier, H West, O Harrysson… - Materials Science and …, 2012 - Elsevier","… Greater force is therefore needed to achieve further compression, thus the significant increase
in apparent strength relative to the more open DV2 unit cell geometry created by its 45° re … Energy
absorption is another property of interest for many applications of metal foams …",Non-stochastic Ti–6Al–4V foam structures with negative Poisson's ratio,Materials Science and …,L Yang
390,"X Xia, X Chen, Z Zhang, X Chen, W Zhao, B Liao",44,2014,No,Materials & Design …,"X Xia, X Chen, Z Zhang, X Chen, W Zhao, B Liao… - Materials & Design …, 2014 - Elsevier","… A. Rabiei, A. O'NeillA study on processing of a composite metal foam via casting … and compressive
deformation behavior of Al-alloy (LM13)-cenosphere hybrid Al-foam prepared using … treatment
on compressive properties of AZ91 Mg and SG91A Al foams with open-cell structure …",Compressive properties of closed-cell aluminum foams with different contents of ceramic microspheres,Materials & Design …,X Xia
391,"N Babcsán, J Banhart, D Leitlmeie",31,2003,[PDF] psu.edu,Proceedings of the International …,"N Babcsán, J Banhart, D Leitlmeier - Proceedings of the International …, 2003 - Citeseer","… Some prefer to call open-cell metallic structures metal sponges, not metal foams … up-to-date
information [7]. The present paper will be restricted to metallic closed-cell foams … gas bubbles
separated from each other by metal films – the corresponding solid metal foams show a …",[PDF][PDF] Metal foams–manufacture and physics of foaming,Proceedings of the International …,N Babcsán
392,"S Elbir, S Yilmaz, AK Toksoy, M Guden",64,2003,[PDF] iyte.edu.tr,Journal of materials …,"S Elbir, S Yilmaz, AK Toksoy, M Guden… - Journal of materials …, 2003 - Springer","… of closed-cell foams can be fitted to the equation, which was developed for the open cell foams
and given … is the yield stress of the foaming metal, C is a constant related to cell geometry and
ρ∗ is the relative density of the foam (ratio of foam density to foaming metal density …",SiC-particulate aluminum composite foams produced by powder compacts: Foaming and compression behavior,Journal of materials …,S Elbir
393,"K Stöbener, G Rausc",43,2009,No,Journal of Materials Science,"K Stöbener, G Rausch - Journal of Materials Science, 2009 - Springer","… of the dense steel volume is replaced by lightweight aluminium foam [5]. Open image in … Analysing
(potential and already established) applications for closed cell aluminium foams revealed, in
many … heated in a furnace until the expansion process starts with melting of the metal …",Aluminium foam–polymer composites: processing and characteristics,Journal of Materials Science,K Stöbener
394,"CD Prest, MS Scott, SP Zadesky, DJ Stratton",17,2015,No,US Patent …,"CD Prest, MS Scott, SP Zadesky, DJ Stratton… - US Patent …, 2015 - Google Patent","… on said substrate to a thermal excursion effective to activate expansion of the foaming agent while …
provide a method for processing bulk-solidifying amorphous alloy materials together with metal
foams to provide … 3 is an electron scanning micrograph of an open cell metal foam …",Insert molding of bulk amorphous alloy into open cell foam,US Patent …,CD Prest
395,N Dukha,25,2012,[PDF] psu.edu,Journal of fluids engineering,"N Dukhan - Journal of fluids engineering, 2012 - … .asmedigitalcollection.asme.org",2,Analysis of Brinkman-extended Darcy flow in porous media and experimental verification using metal foam,Journal of fluids engineering,
396,"P Zhang, ZN Meng, H Zhu, YL Wang, SP Pen",83,2017,No,Applied energy,"P Zhang, ZN Meng, H Zhu, YL Wang, SP Peng - Applied energy, 2017 - Elsevier","… the open-cell porous structure allows for the flow of liquid PCM and large specific contact surface
area between PCM and ligament of metal foam, resulting in a significant heat transfer
enhancement. Xiao et al. [19] fabricated the composite PCMs using different metal foams and …",Melting heat transfer characteristics of a composite phase change material fabricated by paraffin and metal foam,Applied energy,P Zhang
397,"IC Konstantinidis, G Paradisiadis, DN Tsipa",14,2009,No,Theoretical and Applied …,"IC Konstantinidis, G Paradisiadis, DN Tsipas - Theoretical and Applied …, 2009 - Elsevier","… is being conducted to improve the understanding of the stabilizing mechanisms effective during
foaming in molten … 1. Presentation of σ−ε metal foam compression graph. Additionally, a fracture
analysis for the open-cell model is applied based on the energy density concept [24 …",Analytical models for the mechanical behavior of closed and open-cell Al foams,Theoretical and Applied …,IC Konstantinidis
398,"T Wilberforce, A Al Makky, A Baroutaji",17,2017,[DOC] researchgate.net,2017 IEEE Texas …,"T Wilberforce, A Al Makky, A Baroutaji… - 2017 IEEE Texas …, 2017 - ieeexplore.ieee.org","… Abstract— This paper reports the design and development of a Proton Exchange
Membrane (PEM) fuel cell using Aluminum open pore cellular metal foam as the
flow plate material. Effective housing designs are proposed for …",Computational Fluid Dynamic simulation and modelling (CFX) of flow plate in PEM fuel cell using aluminum open cellular foam material,2017 IEEE Texas …,T Wilberforce
399,JC Blom,50,1981,No,US Patent 4,"JC Blome - US Patent 4,265,659, 1981 - Google Patent","… per square inch per minute. The present invention provides a highly efficient ceramic foam material
for use in filtering molten metal, especially molten aluminum. The ceramic foam material of the
present invention is characterized by having an open cell structure with …",Molten metal filter,"US Patent 4,265,659",
400,"Y Luo, S Yu, J Liu, X Zhu, Y Lu",15,2010,No,Journal of Alloys and Compounds,"Y Luo, S Yu, J Liu, X Zhu, Y Luo - Journal of Alloys and Compounds, 2010 - Elsevier","… Recently, there has been a considerable increasing interest in using metal foams as lightweight
structural … rate on the deformation responses of aluminum-fly ash particle composite foam is found …
Little investigation is taken on the characterizations of open-cell composite foams …",Compressive property and energy absorption characteristic of open-cell SiCp/AlSi9Mg composite foams,Journal of Alloys and Compounds,Y Luo
401,"XQ Cao, ZH Wang, L ZHAO, G YAN",15,2006,No,Transactions of Nonferrous …,"XQ Cao, ZH Wang, L ZHAO, G YANG - Transactions of Nonferrous …, 2006 - Elsevier","… BANHART J. Manufacture, characterization and application of cellular metals and metal
foams[J]. Progress in Materials Science, 2001, 46: 559-632. PAN Yi, HU Shi-sheng, FENG Yi,
et al. Cell-size effect on mechanical property of open-cell aluminum alloy foam[J …",Effects of heat treatment on dynamic compressive properties and energy absorption characteristics of open-cell aluminum alloy foams,Transactions of Nonferrous …,XQ Cao
402,"P Elayiaraja, S Harish, L Wilson",19,2010,No,Experimental Heat …,"P Elayiaraja, S Harish, L Wilson… - Experimental Heat …, 2010 - Taylor & Franci","… The heat transfer coefficient of the foam blocks increases as temperature difference between
the heated wall and the ambient air increases and that the copper foam sinks perform 35-40%
better than the aluminum blocks. Hence, the use of open cell metal foams having large …",Experimental investigation on pressure drop and heat transfer characteristics of copper metal foam heat sink,Experimental Heat …,P Elayiaraja
403,"M Malekjafarian, SK Sadrnezhaa",30,2012,No,Materials & Design,"M Malekjafarian, SK Sadrnezhaad - Materials & Design, 2012 - Elsevier","… Alizadeh and Mirzaei-Aliabadi [4] have produced open cell Al–Al 2 O 3 composite … attracted
researchers' attention for being inexpensive and capable of manufacturing close-cell foams [6].
This … Instantaneous release of the gas which contacts with the metal helps formation of the …",Closed-cell Al alloy composite foams: Production and characterization,Materials & Design,M Malekjafarian
404,"Z Wu, C Caliot, G Flamant, Z Wan",130,2011,No,International Journal of Heat and Mass …,"Z Wu, C Caliot, G Flamant, Z Wang - International Journal of Heat and Mass …, 2011 - Elsevier","… Ceramic foams can be described as a reticulated structure of open cells with typically 12–14 … the
face-centred model, the body-centred model [33], Weaire–Phelan's unit cell [34] and …
Weaire–Phelan's model is better able to represent the fine structure of foam materials compared …",Numerical simulation of convective heat transfer between air flow and ceramic foams to optimise volumetric solar air receiver performances,International Journal of Heat and Mass …,Z Wu
405,"H Hu, X Weng, D Zhuang, G Ding, Z Lai, X X",24,2016,No,Applied Thermal …,"H Hu, X Weng, D Zhuang, G Ding, Z Lai, X Xu - Applied Thermal …, 2016 - Elsevier","… In the present study, three open-cell metal foams with PPIs of 5, 10 and 15 will be used to analyze
the influence of structure parameters. In order to compare the performance between the metal
foam heat exchanger and conventional fin-and-tube heat exchanger under …",Heat transfer and pressure drop characteristics of wet air flow in metal foam under dehumidifying conditions,Applied Thermal …,H Hu
406,"CC Chen, PC Huang, HY Hwan",37,2013,No,International Journal of Heat and Mass …,"CC Chen, PC Huang, HY Hwang - International Journal of Heat and Mass …, 2013 - Elsevier","… upon lower plate of an insulated channel utilizing the high-porosity metal foams porous layer …
The properties of porous matrix of metal foam, K and F, for momentum equation are … a function
of porosity after modification to reflect the difference between the open cell represent and …",Enhanced forced convective cooling of heat sources by metal-foam porous layers,International Journal of Heat and Mass …,CC Chen
407,"NQ Zhao, B Jiang, XW Du, JJ Li, CS Shi, WX Zha",25,2006,No,Materials Letters,"NQ Zhao, B Jiang, XW Du, JJ Li, CS Shi, WX Zhao - Materials Letters, 2006 - Elsevier","… Metal foams, especially aluminum foams, are a class of materials with low densities and novel …
A space-holder method has been used for the manufacture of the open cell stochastic foams … Pores
of the resulting foam “replicate” the initial shape of these space-holder particles …",Effect of Y2O3 on the mechanical properties of open cell aluminum foams,Materials Letters,NQ Zhao
408,"AM Bayomy, MZ Saghir, T Yousef",32,2016,No,International Journal of Thermal …,"AM Bayomy, MZ Saghir, T Yousefi - International Journal of Thermal …, 2016 - Elsevier","… Zhao et al. [10] studied the thermal dissipation of high porosity metal foams, both
experimentally and analytically. They … Zhao et al. [11], [5] presented analytical studies
of forced convection through open cell metal foam. They …",Electronic cooling using water flow in aluminum metal foam heat sink: Experimental and numerical approach,International Journal of Thermal …,AM Bayomy
409,"L Santo, A Guglielmotti",11,2010,No,ASME 2010 …,"L Santo, A Guglielmotti… - ASME 2010 …, 2010 - … .asmedigitalcollection.asme.org","… in the desired shape and no forming operation was considered. In fact, apart from
compression, open-cell aluminum foams show a very poor deformation. In order to study
the metal foam formability, compression tests are typically performed …",Formability of Open-Cell Aluminum Foams by Laser,ASME 2010 …,L Santo
