,Authors,Citations,Date,Full Text Available,Journal,Stats,Summary,Title,Journals,First Author
183,"AH Brothers, DC Dunan",109,2008,[PDF] semanticscholar.org,Materials Science and Engineering: A,"AH Brothers, DC Dunand - Materials Science and Engineering: A, 2008 - Elsevier","… by extrapolating from a standard specimen with a low and uniform density ρ o , via the
semi-empirical Gibson–Ashby equation for strength in open-cell foams [10]. According to this
equation, the ratio of compressive yield strengths between the foam and the solid metal, σ y /σ …",Mechanical properties of a density-graded replicated aluminum foam,Materials Science and Engineering: A,AH Brothers
184,"G Laschet, T Kashko, S Angel, J Scheele",28,2008,No,Materials Science and …,"G Laschet, T Kashko, S Angel, J Scheele… - Materials Science and …, 2008 - Elsevier","… 6], [7] have been proposed recently in the literature to predict the permeability of open-cell foams …
permeability predictions and the corresponding Stokes flows, obtained by the different unit cell
models, then … 2. Characterisation of metal foams produced by the SRFS-process. 2.1 …",Microstructure based model for permeability predictions of open-cell metallic foams via homogenization,Materials Science and …,G Laschet
185,"S Guarino, G Rubino, V Tagliaferri, N Ucciardell",19,2015,No,Measurement,"S Guarino, G Rubino, V Tagliaferri, N Ucciardello - Measurement, 2015 - Elsevier","… processes have been developed and reported in literatures [1], [6], [7] and [8]. Each method can
be chosen with selected metals, depending on the morphology (closed cell or open cell structure),
density and cell size desired … Open cells metal foams present structures …",Thermal behavior of open cell aluminum foams in forced air: experimental analysis,Measurement,S Guarino
186,"S Arnaboldi, P Bassani, F Passaretti, A Redaelli",15,2011,No,Journal of materials …,"S Arnaboldi, P Bassani, F Passaretti, A Redaelli… - Journal of materials …, 2011 - Springer","In the recent years, the research for novel materials with tailored mechanical properties, as well as functional properties, has encouraged the study of porous and cellular materials. Our previous work proposed and reported about the possibility to manufacture open-cell metal ",Functional Characterization of shape memory CuZnAl open-cell foams by molten metal infiltration,Journal of materials …,S Arnaboldi
187,"M Saber, TT Huu, C Ph",37,2012,[PDF] researchgate.net,uu,"M Saber, TT Huu, C Pham-Huu, D Edouard - Chemical Engineering …, 2012 - Elsevier","… be observed that the highest mass transfer coefficient is obtained for the open-cell foam exhibiting
the … investigations including tri-phasic (gas–liquid–solid) transfer phenomena through different
open-cell foams is required … [1] L. TianjianUltraligh porous metal: from fundamentals …","Residence time distribution, axial liquid dispersion and dynamic–static liquid mass transfer in trickle flow reactor containing β-SiC open-cell foams",Chemical Engineering …,M Saber
188,"H Yu, Z Guo, B Li, G Yao, H Luo, Y Li",87,2007,No,Materials Science and Engineering …,"H Yu, Z Guo, B Li, G Yao, H Luo, Y Liu - Materials Science and Engineering …, 2007 - Elsevier","… on compressive and energy absorption properties, only researches on the open-cell and model …
Closed-cell aluminum foams were prepared by molten body transitional foaming process in …
process has five steps: (1) moltening aluminum (99.99%) and calcium metal in industrial …",Research into the effect of cell diameter of aluminum foam on its compressive and energy absorption properties,Materials Science and Engineering …,H Yu
189,"Q Fabrizio, A Boschetto, L Rovatti, L Sant",18,2011,No,Materials Letters,"Q Fabrizio, A Boschetto, L Rovatti, L Santo - Materials Letters, 2011 - Elsevier","… the grains together [1]. Molten metal was then poured in to infiltrate the pores of the sintered
preform, and the salt dissolved to produce an open-cell foam with cell size about 3–4 mm. In
2001, San Marchi and Mortensen revive the production of high-purity foams by replication [2 …",Replication casting of open-cell AlSi7Mg0. 3 foams,Materials Letters,Q Fabrizio
190,"P Ranut, E Nobile, L Mancin",68,2014,[PDF] researchgate.net,Applied thermal engineering,"P Ranut, E Nobile, L Mancini - Applied thermal engineering, 2014 - Elsevier","… Typically, the pore density of uncompressed open-cell foams varies between 5 and 100 PPI …
literature, several examples are provided about the employment of metal foams in heat … dealing
with both experimental, numerical and analytical investigations: metal foam channels [1 …",High resolution microtomography-based CFD simulation of flow and heat transfer in aluminum metal foams,Applied thermal engineering,P Ranut
191,"X Han, N Kashif, J Bock, AM Jacob",12,2012,[PDF] purdue.edu,201,"X Han, N Kashif, J Bock, AM Jacobi - 2012 - docs.lib.purdue.edu","Metal foams with an open-cell structure have physical and mechanical properties suggesting they might have advantages over conventional fin materials for use in air-cooling heat exchangers. For example, metal foams are low weight, have high to very high specific",Open-cell metal foams for use in dehumidifying heat exchangers,,X Han
192,"Z Rueger, RS Lake",26,2016,[PDF] wisc.edu,Philosophical Magazine,"Z Rueger, RS Lakes - Philosophical Magazine, 2016 - Taylor & Franci","… Softening size effects have also been observed in metal foams in compression and bending;
these have been … Such localization can occur in foam at sufficiently high strain levels … scatter was
observed to be considerably greater in the present low-density open-cell foams than it …",Experimental Cosserat elasticity in open-cell polymer foam,Philosophical Magazine,Z Rueger
193,"A Jung, H Natter, R Hempelmann, S Diebels",12,2010,No,ECS …,"A Jung, H Natter, R Hempelmann, S Diebels… - ECS …, 2010 - ecst.ecsdl.org","In order to enhance their stiffness, strength and energy absorption capability open-cell aluminum foams have been coated with nickel by electrodeposition. The coating thickness distribution is very important for the properties of the coated foams. A method to assess the",Electrodeposition of nanocrystalline metals on open cell metal foams: improved mechanical properties,ECS …,A Jung
194,"G Laschet, J Sauerhering, O Reutter, T Fend",27,2009,No,Computational Materials …,"G Laschet, J Sauerhering, O Reutter, T Fend… - Computational Materials …, 2009 - Elsevier","… As open-cell foams present a random microstructure, it is interesting to analyse the influence
of the … Starting from the center of the digitalized foam part, the RVE was translated successively …
that during this translation, the characteristic periods and the pore/metal threshold remain …",Effective permeability and thermal conductivity of open-cell metallic foams via homogenization on a microstructure model,Computational Materials …,G Laschet
195,"C Yan, L Hao, A Hussein, SL Bubb, P Young",128,2014,No,Journal of Materials …,"C Yan, L Hao, A Hussein, SL Bubb, P Young… - Journal of Materials …, 2014 - Elsevier","… Although DMLS or SLM has been applied to make lattice structures using the metal materials
of stainless steel … tanks (Wang et al., 2006), and for instance, it was reported that aluminium foams
offer good … Duocel aluminium open-cell foam belongs to designed cellular structures …",Evaluation of light-weight AlSi10Mg periodic cellular lattice structures fabricated via direct metal laser sintering,Journal of Materials …,C Yan
196,"R Coquard, M Loretz, D Bailli",40,2008,No,Advanced engineering …,"R Coquard, M Loretz, D Baillis - Advanced engineering …, 2008 - Wiley Online Library","… of the solid portion of the foam conductivity is needed in effective conductivity models. Battacharya,
Calmidi and Mahajan[6] also provided an analysis for estimating the effective thermal conductivity
of high porosity metal foams. They represented the open cell structure by a …",Conductive Heat Transfer in Metallic/Ceramic Open‐Cell Foams,Advanced engineering …,R Coquard
197,"DP Mondal, MD Goel, S Da",100,2009,No,Materials Science and Engineering: A,"DP Mondal, MD Goel, S Das - Materials Science and Engineering: A, 2009 - Elsevier","… Recently, Montanini [8] studied three types of foam including both open cell and closed cell and
observed that … The deformation, in the metal foam, particularly in plateau region is primarily
controlled by bending, shearing, crushing and compaction of cell walls vis-à-vis …",Compressive deformation and energy absorption characteristics of closed cell aluminum-fly ash particle composite foam,Materials Science and Engineering: A,DP Mondal
198,"MS Aly, A Almajid, S Nakano, S Ochia",19,2009,No,Materials Science and …,"MS Aly, A Almajid, S Nakano, S Ochiai - Materials Science and …, 2009 - Elsevier","… 2. Tensile stress– strain curve of open cell copper foam … stress at some weak position over the
strut exceeds the failure strength of the corresponding solid metal, the fracture … A non-uniform
strut thickness or strut containing voids weakens the foam mechanical properties [19], [20 …",Fracture of open cell copper foams under tension,Materials Science and …,MS Aly
199,"S Mancin, C Zilio, A Diani, L Rossett",90,2013,No,… Journal of Heat and Mass Transfer,"S Mancin, C Zilio, A Diani, L Rossetto - … Journal of Heat and Mass Transfer, 2013 - Elsevier","… of the foams, the operation with air appears to be the most viable solution in several applications,
from the air conditioning to the electronic cooling. For this reason several researchers have deeply
analyzed the heat transfer capabilities of open cell metal and carbon foam heat …",Air forced convection through metal foams: Experimental results and modeling,,S Mancin
200,"OB Olurin, M Arnold, C Körner, RF Singe",119,2002,No,Materials Science and …,"OB Olurin, M Arnold, C Körner, RF Singer - Materials Science and …, 2002 - Elsevier","… structural parameters are the relative density, the degree to which the cell is open or closed … The
closed cell aluminium alloy foams studied are the Mepura (cast) alloy foam of composition … These
foams are made by mixing the foaming agent (TiH 2 ) with metal powder, followed …",The investigation of morphometric parameters of aluminium foams using micro-computed tomography,Materials Science and …,OB Olurin
201,"BH Smith, S Szyniszewski, JF Hajjar",152,2012,[PDF] surrey.ac.uk,… of Constructional Steel …,"BH Smith, S Szyniszewski, JF Hajjar… - … of Constructional Steel …, 2012 - Elsevier","… Existing aluminum foam applications have been summarized according to how the advantage
of foaming has been … Load transfer to the support limited by the foam yield … Heat exchanger, X,
X, Open cell metal foams allow fluid transport, potential application for wall to be integrated …","Steel foam for structures: A review of applications, manufacturing and material properties",,BH Smith
202,"EN Schmierer, A Razan",58,2006,No,Journal of …,"EN Schmierer, A Razani - Journal of …, 2006 - … .asmedigitalcollection.asme.org",2,Self-consistent open-celled metal foam model for thermal applications,Journal of …,EN Schmierer
203,"J Chen, D Yang, J Jiang, A Ma, D Son",44,2014,[PDF] sciencedirect.com,Procedia Materials Science,"J Chen, D Yang, J Jiang, A Ma, D Song - Procedia Materials Science, 2014 - Elsevier","… metal, containing a large volume fraction of gas-filled pores. The pores can be sealed
(closed-cell foam) or form an interconnected network (open-cell foam). Due to the high
surface-area to volume ratio and strong mixing capability, high porosity open-cell light-metallic …",Research progress of phase change materials (PCMs) embedded with metal foam (a review),Procedia Materials Science,J Chen
204,K Keega,28,2003,[PDF] googleapis.com,US Patent App. 10/147,"K Keegan - US Patent App. 10/147,406, 2003 - Google Patent","… The material is then heated to a temperature sufficient to soften the metal or metal allow powder,
and decompose the foaming agent, thereby … [0052]. Solidification in an open-celled mold is a
method of making metal foam that uses a reticulated open-cell “polymer” foam as …",Solid oxide fuel cell with a metal foam seal,"US Patent App. 10/147,406",
205,"ZG Xu, JW Fu, TJ Luo, YS Yan",45,2012,[PDF] researchgate.net,Materials & Design,"ZG Xu, JW Fu, TJ Luo, YS Yang - Materials & Design, 2012 - Elsevier","… Later, open cell Mg alloy foam was fabricated by Yamada et al … Direct foaming method, one of
the most successful techniques applied to making close cell metal foams, has not be … and Lin
reported the application of direct foaming method to Mg and Mg alloy foam fabrication [13 …",Effects of cell size on quasi-static compressive properties of Mg alloy foams,Materials & Design,ZG Xu
206,"Y Mu, G Yao, H Lu",41,2010,No,Materials & Design,"Y Mu, G Yao, H Luo - Materials & Design, 2010 - Elsevier","… structural anisotropy and material anisotropy [1]. The more obvious for metal foams is structural …
process is also sensitive to specimen orientation [5]. For the open-cell foam, the mechanical … on
the comparison between anisotropic mechanical properties of closed-cell Al foams …",Effect of cell shape anisotropy on the compressive behavior of closed-cell aluminum foams,Materials & Design,Y Mu
207,"JB Li, HC Lin, JSC Jang, CN Kuo, JC Huan",23,2013,[PDF] nsysu.edu.tw,Materials Letters,"JB Li, HC Lin, JSC Jang, CN Kuo, JC Huang - Materials Letters, 2013 - Elsevier","… Metallic foam materials could exhibit properties like high compressive plastic strain and high
energy absorption … model, the structure of the porous material is simplified to an open-cell porous
material … It is assumed that the deformation of the porous metal is dominated by the …",Novel open-cell bulk metallic glass foams with promising characteristics,Materials Letters,JB Li
208,F Garc,93,2016,[PDF] mdpi.com,oren,"F García-Moreno - Materials, 2016 - mdpi.com","… The resulting nickel metal foam, after being heat treated, is used in applications where high
electrical … to be resistant to the high temperatures of the corresponding molten metal and be … later
to the pores and pore interconnections, respectively, leading to an open cell structure …",Commercial applications of metal foams: Their properties and production,Materials,
209,"Y Conde, A Pollien, A Mortense",35,2006,[PDF] epfl.ch,Scripta materialia,"Y Conde, A Pollien, A Mortensen - Scripta materialia, 2006 - Elsevier","… positions x, for h = 20 mm, t = 1 mm and considering a 6061 Al alloy open-pore foam … take C as
unity and ϕ, the fraction of solid which is contained in the cell edges, as … In conclusion, analysis
of a simple metal foam core metal skin sandwich beam in bending shows that, where …",Functional grading of metal foam cores for yield-limited lightweight sandwich beams,Scripta materialia,Y Conde
210,"AR Kennedy, S Asavavisitcha",94,2004,No,Scripta Materialia,"AR Kennedy, S Asavavisitchai - Scripta Materialia, 2004 - Elsevier","… pure Al foams do not show the typical well-defined plateau stress that is often observed in metal
foams but the … 6. (a) Ten percent proof stress and (b) energy absorbed as a function of foam density
for pure Al and … (1) is a relationship proven to hold well for open cell foams [6], the …","Effects of TiB2 particle addition on the expansion, structure and mechanical properties of PM Al foams",Scripta Materialia,AR Kennedy
211,"W Wang, R Burgueño, JW Hong, I Le",23,2013,No,Materials Science and …,"W Wang, R Burgueño, JW Hong, I Lee - Materials Science and …, 2013 - Elsevier","… A blowing agent (eg,TiH 2 ) is added afterwards to facilitate direct foaming of the metal [11], [12] …
The presented investigation aimed at demonstrating the hypothesis that a stiff nano-structured
metal coating on an open-cell foam would lead to enhanced energy absorption …",Nano-deposition on 3-D open-cell aluminum foam materials for improved energy absorption capacity,Materials Science and …,W Wang
212,"A Antenucci, S Guarino, V Tagliaferri, N Ucciardell",24,2014,[HTML] sciencedirect.com,Materials & design,"A Antenucci, S Guarino, V Tagliaferri, N Ucciardello - Materials & design, 2014 - Elsevier","… and sintering process [13,15], replication process [1,13], melt-gas injection, melt-foaming agent,
casting … With this process, a polymeric open-cell foam of convenient porosity is covered with a
slurry (ceramic … the polymer melts leaving a void that can be filled with a metal, in this …",[HTML][HTML] Improvement of the mechanical and thermal characteristics of open cell aluminum foams by the electrodeposition of Cu,Materials & design,A Antenucci
213,"PR Onck, R Van Merkerk",26,2004,No,Advanced …,"PR Onck, R Van Merkerk… - Advanced …, 2004 - Wiley Online Library","… processing (see also[2,3]). For a successful imple- mentation of metal foams and the … reliability
assessment, mechanism-based models are needed that relate the cell-wall microstructure …
observations of the fracture behavior of small samples of Duocel open-cell foam, in addition …",Fracture of Metal Foams: In‐situ Testing and Numerical Modeling,Advanced …,PR Onck
214,"M Nazari, M Ashouri, MH Kayhani, A Tamayo",55,2015,[PDF] researchgate.net,International Journal of …,"M Nazari, M Ashouri, MH Kayhani, A Tamayol - International Journal of …, 2015 - Elsevier","… Hutter et al. [4] characterized the heat transfer in tubular reactors filled with commercial metal
foams, over a wide range of Reynolds numbers … 4. Conclusion. Open cell porous media
(metal foam) has been widely used in many industrial applications …",Experimental study of convective heat transfer of a nanofluid through a pipe filled with metal foam,International Journal of …,M Nazari
215,MA ,47,2008,[PDF] researchgate.net,adek,"MA El-Hadek, S Kaytbay - … Journal of Mechanics and Materials in Design, 2008 - Springer","… The overwhelming majority of metal foams in the market are therefore closed-cell.
For functional applications, such as sound absorption, thermal insulation, heat
dissipation and catalyst support, the cells need to be open and small …",Mechanical and physical characterization of copper foam,,
216,E Cruz Rui,10,2004,No,200,E Cruz Ruiz - 2004 - dire.uprm.edu,"High porosity metal foams are excellent candidates for high heat dissipation. They are employed in aerospace applications mainly, but their use has been widened to include cooling in Electronic Packaging. Other important applications have been found taking",Modelling of heat transfer in open cell metal foams,,
217,"P Quadbeck, K Kümmel, R Hauser",11,2010,[PDF] fraunhofer.de,Proceedings of the …,"P Quadbeck, K Kümmel, R Hauser… - Proceedings of the …, 2010 - ifam.fraunhofer.de",High porosity permeable materials have been manufactured on the basis of the highly uniform structure of foamed polyurethane since the early 60 th. Open cell ceramic foams on the basis of a replication method for foundry filtration have been used. Such replication,[PDF][PDF] Open cell metal foams-application-oriented structure and material selection,Proceedings of the …,P Quadbeck
218,"A Inayat, M Klumpp, M Lämmermann, H Freund",39,2016,No,Chemical Engineering …,"A Inayat, M Klumpp, M Lämmermann, H Freund… - Chemical Engineering …, 2016 - Elsevier","… surface area, high mechanical strength, excellent thermal conductivity (eg metal and SiC … work
to develop a general pressure drop correlation for open-cell foams completely based … the pressure
drop prediction solely based on easily measurable geometric foam properties and …",Development of a new pressure drop correlation for open-cell foams based completely on theoretical grounds: Taking into account strut shape and geometric …,Chemical Engineering …,A Inayat
219,"AJ Fuller, T Kim, HP Hodson",55,2005,[PDF] psu.edu,Proceedings of the …,"AJ Fuller, T Kim, HP Hodson… - Proceedings of the …, 2005 - journals.sagepub.com","… 3 MODELLING THE FOAM STRUCTURE The thermal and hydraulic behaviour of open-cell metal
foams is governed by such features of the foam structure as the ligament and pore diameters. The
FeCrAlY foams have hollow ligaments owing to the sintering process …",Measurement and interpretation of the heat transfer coefficients of metal foams,Proceedings of the …,AJ Fuller
220,"S Mancin, C Zilio, A Cavallini, L Rossett",89,2010,No,International Journal of Heat and …,"S Mancin, C Zilio, A Cavallini, L Rossetto - International Journal of Heat and …, 2010 - Elsevier","… different rigid, open cell, aluminum metal foams, when electrically heated and cooled by air flowing
through. It follows a paper by present authors relative to experimental measures and theoretical
modelling of pressure drop during air flow in foams [1]. The metal foam consists in …",Heat transfer during air flow in aluminum foams,International Journal of Heat and …,S Mancin
221,"E Amsterdam, H van Hoorn",28,2008,No,Advanced …,"E Amsterdam, H van Hoorn… - Advanced …, 2008 - Wiley Online Library","… There are numerous processes for the fabrication of open- and closed cell metal foams and some
of … In fact, X-ray tomography can be used to measure a large number of cells with high
precision.[10,11,12] From the measured aspect ratio in the cell shape the anisotro- py in …",The influence of cell shape anisotropy on the tensile behavior of open cell aluminum foam,Advanced …,E Amsterdam
222,"JL Yu, X Wang, ZG Wei, EH Wan",94,2003,[PDF] researchgate.net,International Journal of Impact …,"JL Yu, X Wang, ZG Wei, EH Wang - International Journal of Impact …, 2003 - Elsevier","… 13] reported that an open cell magnesium foam AZ91, an open cell aluminum foam … Paul and
Ramamurty [14] investigated the strain-rate sensitivity of a closed cell aluminum foam under
nominal strain rates from … Metal foams are frequently used in the form of foam core structures …",Deformation and failure mechanism of dynamically loaded sandwich beams with aluminum-foam core,International Journal of Impact …,JL Yu
223,"PJ Tan, JJ Harrigan, SR Rei",124,2002,No,Materials science and technology,"PJ Tan, JJ Harrigan, SR Reid - Materials science and technology, 2002 - Taylor & Franci","… Contribution to `Metal matrix composites VIII' (MMC VIII) held at the Institute of Materials in London
on … r qs cr =r ys ~0:090(q o =q s)3=2 : : : : : 9) for a large cell foam … to the crushing strengths of the
specimens.9 Again, this is consistent with the behaviour of open cell foams …",Inertia effects in uniaxial dynamic compression of a closed cell aluminium alloy foam,Materials science and technology,PJ Tan
224,"A Montebelli, CG Visconti, G Groppi, E Tronconi",35,2014,No,Applied Catalysis A …,"A Montebelli, CG Visconti, G Groppi, E Tronconi… - Applied Catalysis A …, 2014 - Elsevier","… activity testing was not to demonstrate the good heat transfer properties of the metal foam (to
be … likely due to the long-chain polymeric structure of Tylose, acting as “foaming” agent … 4. Optical
microscope images of 45 PPI, ɛ = 0.936 open-cell copper foam sample (a) bare sample …",Washcoating and chemical testing of a commercial Cu/ZnO/Al2O3 catalyst for the methanol synthesis over copper open-cell foams,Applied Catalysis A …,A Montebelli
225,"JR González, F Nacimiento, R Alcántara, GF Ortiz",28,2013,[PDF] academia.edu,…,"JR González, F Nacimiento, R Alcántara, GF Ortiz… - …, 2013 - pubs.rsc.org","… Fig. 9 Electrochemical behaviour for Co–Sn (35 mA cm −2 –5 min)/Ni electrode in sodium test
cell. (A) Potential–capacity plot for the first two cycles. (B) Areal capacity as a function of cycle
number … The use of open-type metal foams as substrates for the electrodeposition of …",Electrodeposited CoSn 2 on nickel open-cell foam: advancing towards high power lithium ion and sodium ion batteries,,JR González
226,"G Hetsroni, M Gurevich, R Rozenbli",35,2008,[PDF] technion.ac.il,Experimental Thermal and Fluid …,"G Hetsroni, M Gurevich, R Rozenblit - Experimental Thermal and Fluid …, 2008 - Elsevier","… Experiments were performed with a wide variety of aluminum metal foams. Results indicate that
for foam–air combinations, the transport enhancing effect of thermal dispersion at forced
convection is extremely low due to the … [9] considered open-cell metal foam as cooling media …",Natural convection in metal foam strips with internal heat generation,Experimental Thermal and Fluid …,G Hetsroni
227,"A Hamadouche, R Nebbali, H Benahmed",24,2016,No,… Thermal and Fluid …,"A Hamadouche, R Nebbali, H Benahmed… - … Thermal and Fluid …, 2016 - Elsevier","… In heat transfer, the foam ligaments normal to the flow direction cause boundary layer disruption
and enhance flow mixing, while the solid struts enhance the heat transfer by conduction. Actually,
the heat transfer properties of open-cell metal foams are so promising that such …",Experimental investigation of convective heat transfer in an open-cell aluminum foams,,A Hamadouche
