,Authors,Citations,Date,Full Text Available,Journal,Stats,Summary,Title,Journals,First Author
0,"TJ Lu, HA Stone, MF Ashb",567,1998,[PDF] paper.edu.cn,Acta materialia,"TJ Lu, HA Stone, MF Ashby - Acta materialia, 1998 - Elsevier","The paper explores the use of open-celled metal foams as compact heat exchangers, exploiting convective cooling. An analytical model is developed for model foams with simple cubic unit cells consisting of heated slender cylinders, based on existing heat transfer data",Heat transfer in open-cell metal foams,Acta materialia,TJ Lu
1,"K Boomsma, D Poulikakos, Y Ventiko",295,2003,[PDF] psu.edu,… Journal of Heat and Fluid Flow,"K Boomsma, D Poulikakos, Y Ventikos - … Journal of Heat and Fluid Flow, 2003 - Elsevier",A new approach to modeling the flow through a porous medium with a well defined structure is presented. This approach entailed modeling an idealized open cell metal foam based on a fundamental periodic unit of eight cells and solving the flow through the three-dimensional,Simulations of flow through open cell metal foams using an idealized periodic cell structure,,K Boomsma
2,"S Krishnan, JY Murthy",198,2006,[PDF] purdue.edu,Journal of …,"S Krishnan, JY Murthy… - Journal of …, 2006 - … .asmedigitalcollection.asme.org","Flows in porous media may be modeled using two major classes of approaches:(a) a macroscopic approach, where volume-averaged semiempirical equations are used to describe flow characteristics, and (b) a microscopic approach, where small-scale flow details",Direct simulation of transport in open-cell metal foam,Journal of …,S Krishnan
3,"A Kopanidis, A Theodorakakos, E Gavaises",141,2010,[PDF] academia.edu,International Journal of …,"A Kopanidis, A Theodorakakos, E Gavaises… - International Journal of …, 2010 - Elsevier","A 3D numerical simulation methodology for the flow and heat transfer at the pore scale level of high porosity open cell metal foam is presented. The pore scale topology is directly represented with a 3D numerical model of the geometry, which is discretised using a",3D numerical simulation of flow and conjugate heat transfer through a pore scale model of high porosity open cell metal foam,International Journal of …,A Kopanidis
4,"YW Kwon, RE Cooke, C Par",119,2003,No,Materials Science and Engineering: A,"YW Kwon, RE Cooke, C Park - Materials Science and Engineering: A, 2003 - Elsevier",Representative unit-cell models were developed for open-cell metallic foams in order to predict their effective elastic moduli and the failure strengths. Two different open-cell metallic foams were considered. One was just open-cell foam and the other was open-cell foam filled,Representative unit-cell models for open-cell metal foams with or without elastic filler,Materials Science and Engineering: A,YW Kwon
5,"N Dukhan, PD Quinon",102,2005,[PDF] academia.edu,amos,"N Dukhan, PD Quinones-Ramos, E Cruz-Ruiz… - International Journal of …, 2005 - Elsevier",A one-dimensional heat transfer model for open-cell metal foam is presented. The model combines the conduction in the ligaments and the convection to the coolant in the pores. The approach avoids a complete three-dimensional modeling of the complex flow and heat,One-dimensional heat transfer analysis in open-cell 10-ppi metal foam,International Journal of …,N Dukhan
6,"DT Queheillalt, DD Hass, DJ Sypeck",93,2001,[PDF] 128.143.22.36,Journal of Materials …,"DT Queheillalt, DD Hass, DJ Sypeck… - Journal of Materials …, 2001 - cambridge.org","Low-density, open-cell nickel base superalloy foams have been synthesized by a high-rate, electron beam-directed vapor deposition process and their mechanical properties evaluated. The deposition process uses an open-cell polymer foam template upon which is",Synthesis of open-cell metal foams by templated directed vapor deposition,Journal of Materials …,DT Queheillalt
7,"B Ozmat, B Leyda, B Benso",82,2004,[PDF] metallicfoams.com,Materials and manufacturing …,"B Ozmat, B Leyda, B Benson - Materials and manufacturing …, 2004 - Taylor & Franci",The key structural and thermo-physical properties of reticulated metal foams (RMF) are reviewed. Analytical expressions relating such properties to basic structural parameters are developed through mathematical modeling and experimental studies. Conductive and,Thermal applications of open-cell metal foams,Materials and manufacturing …,B Ozmat
8,"M Bai, JN Chun",99,2011,No,International Journal of Thermal Sciences,"M Bai, JN Chung - International Journal of Thermal Sciences, 2011 - Elsevier","Enhanced cooling methods are needed for advanced power systems. A promising method is using an open-cell metal foam to improve the heat transfer rates. However, the pressure drop induced by the metal foams is relatively higher and thus becomes a critical issue in",Analytical and numerical prediction of heat transfer and pressure drop in open-cell metal foams,International Journal of Thermal Sciences,M Bai
9,"KK Bodla, JY Murthy, SV Garimell",91,2010,[PDF] purdue.edu,Numerical Heat Transfer,"KK Bodla, JY Murthy, SV Garimella - Numerical Heat Transfer, Part …, 2010 - Taylor & Franci","Important heat transfer parameters of aluminum foams of varying pore sizes are investigated through CT-scanning at 20 micron resolution. Small sub-samples from the resulting images are processed to generate feature-preserving, finite-volume meshes of high quality. All three",Microtomography-based simulation of transport through open-cell metal foams,"Numerical Heat Transfer, Part …",KK Bodla
10,"L Jing, Z Wang, J Ning, L Zha",73,2011,No,Composites Part B: Engineering,"L Jing, Z Wang, J Ning, L Zhao - Composites Part B: Engineering, 2011 - Elsevier","The deformation and failure modes of dynamically loaded sandwich beams made of aluminum skins with open-cell aluminum foam cores were investigated experimentally. The dynamic compressive stress–strain curves of core materials, open-cell aluminum foam, were",The dynamic response of sandwich beams with open-cell metal foam cores,Composites Part B: Engineering,L Jing
11,"KC Leong, LW Ji",65,2006,No,International Journal of Heat and fluid flow,"KC Leong, LW Jin - International Journal of Heat and fluid flow, 2006 - Elsevier",An experimental study was performed to investigate the characteristics of oscillating flow through a channel filled with open-cell metal foam with a fully inter-connected pore structure. Detailed experimental data of oscillating flow pressure drops and velocities for a wide range,Characteristics of oscillating flow through a channel filled with open-cell metal foam,International Journal of Heat and fluid flow,KC Leong
12,"WY Jang, S Kyriakides, AM Krayni",102,2010,[HTML] sciencedirect.com,International Journal of Solids and …,"WY Jang, S Kyriakides, AM Kraynik - International Journal of Solids and …, 2010 - Elsevier","Two families of finite element models of anisotropic, aluminum alloy, open-cell foams are developed and their predictions of elastic properties and compressive strength are evaluated by direct comparison to experimental results. In the first family of models, the",[HTML][HTML] On the compressive strength of open-cell metal foams with Kelvin and random cell structures,International Journal of Solids and …,WY Jang
13,"X Xiao, P Zhang, M L",91,2014,No,International Journal of Thermal Sciences,"X Xiao, P Zhang, M Li - International Journal of Thermal Sciences, 2014 - Elsevier","The thermal conductivity of phase change material (PCM) significantly affects the thermal performance of latent heat thermal energy storage (LHTES) system, which is attractive for energy conservation and waste heat utilization. Metal foam can be applied to enhance the",Effective thermal conductivity of open-cell metal foams impregnated with pure paraffin for latent heat storage,International Journal of Thermal Sciences,X Xiao
14,"KP Dharmasena, HNG Wadle",78,2002,[PDF] virginia.edu,Journal of materials research,"KP Dharmasena, HNG Wadley - Journal of materials research, 2002 - cambridge.org","Cellular metal foams are of interest because of the ability to tailor their mechanical, thermal, acoustic, and electrical properties by varying the relative density and cell morphology. Here, a tetrakaidecahedral unit-cell approach is used to represent an open-cell aluminum foam ",Electrical conductivity of open-cell metal foams,Journal of materials research,KP Dharmasena
15,"M Vesenjak, C Veyhl, T Fiedle",55,2012,No,Materials Science and Engineering: A,"M Vesenjak, C Veyhl, T Fiedler - Materials Science and Engineering: A, 2012 - Elsevier",This paper addresses numerical and experimental analysis of the m. pore® aluminium foam. Numerical models are based on computed tomography data in order to capture the complex material meso-structure. Uni-axial experimental tests were performed for quasi-static loading,Analysis of anisotropy and strain rate sensitivity of open-cell metal foam,Materials Science and Engineering: A,M Vesenjak
16,"DT Queheillalt, Y Katsumura, HNG Wadle",96,2004,[PDF] semanticscholar.org,Scripta Materialia,"DT Queheillalt, Y Katsumura, HNG Wadley - Scripta Materialia, 2004 - Elsevier","… The powder coated carbon foam was transient liquid phase sintered, densifying the powder
coating resulting … were measured and found to be comparable to theoretical models for open cell,
stochastic foams … [1] HNG WadleyCellular metals and metal foaming technology. Verlag …",Synthesis of stochastic open cell Ni-based foams,Scripta Materialia,DT Queheillalt
17,"S Krishnan, SV Garimella",70,2008,[PDF] purdue.edu,Journal of …,"S Krishnan, SV Garimella… - Journal of …, 2008 - … .asmedigitalcollection.asme.org",Direct simulation of thermal transport in open-cell metal foams is conducted using different periodic unit-cell geometries. The periodic unit-cell structures are constructed by assuming the pore space to be spherical and subtracting the pore space from a unit cube of the metal,Simulation of thermal transport in open-cell metal foams: effect of periodic unit-cell structure,Journal of …,S Krishnan
18,"M Wang, N Pa",221,2008,[PDF] psu.edu,International Journal of Heat and Mass Transfer,"M Wang, N Pan - International Journal of Heat and Mass Transfer, 2008 - Elsevier","… and burn rate enhancer for solid propellants [7], [8]. More recently, the metal foams have been …
evaluations of the effective thermal transport properties of such porous foam materials … proposed
for modeling and predicting the effective thermal conductivity of open-cell porous foam …",Modeling and prediction of the effective thermal conductivity of random open-cell porous foams,International Journal of Heat and Mass Transfer,M Wang
19,"C San Marchi, A Mortense",194,2001,[PDF] epfl.ch,Acta Materialia,"C San Marchi, A Mortensen - Acta Materialia, 2001 - Elsevier","… g cm −3 ). These foams feature cells of relatively uniform size and a cell diameter of … The replication
technique consists of three basic steps: preparation of an open-pore pattern, infiltration of the …
the desired metal, and subsequent removal of the pattern to produce a metal sponge …",Deformation of open-cell aluminum foam,Acta Materialia,C San Marchi
20,I Ghos,47,2008,No,Journal of heat transfer,"I Ghosh - Journal of heat transfer, 2008 - … .asmedigitalcollection.asme.org","Forced convection heat transfer in high porosity metal foam, either attached to an isothermal surface or confined between two isothermal plates, has been analyzed, assuming a repetitive simple cubic structure for the foam matrix. The model, in the microscopic level",Heat-transfer analysis of high porosity open-cell metal foam,Journal of heat transfer,
21,"K Boomsma, D Poulikakos, F Zwic",663,2003,[PDF] dtic.mil,Mechanics of materials,"K Boomsma, D Poulikakos, F Zwick - Mechanics of materials, 2003 - Elsevier","… Almost every assembled heat exchanger showed an increase in the flow resistance compared
to its unbrazed counterpart due to the presence of the brazing material in the pores of the
open-cell metal foam at the brazing interface. Foams 95-08 and 92-06 showed a slight …",Metal foams as compact high performance heat exchangers,Mechanics of materials,K Boomsma
22,"KA Dannemann, J Lankford J",318,2000,No,Materials Science and Engineering: A,"KA Dannemann, J Lankford Jr - Materials Science and Engineering: A, 2000 - Elsevier","… 2. Additional investigations have been conducted in our laboratory on open- and
closed-cell (Alporas) metal foams in an effort to better understand the factors contributing
to strain-rate dependency in these materials. Download full-size image. Fig …",High strain rate compression of closed-cell aluminium foams,Materials Science and Engineering: A,KA Dannemann
23,I Ghos,44,2009,No,Journal of Heat Transfer,"I Ghosh - Journal of Heat Transfer, 2009 - ebooks.asmedigitalcollection.asme …",High porosity open-cell metal foam is considered to be an attractive choice for compact heat exchanger applications because of its high area density and superior thermal performance. A systematic study has been made in the present article to verify the suitability of the porous,How good is open-cell metal foam as heat transfer surface?,Journal of Heat Transfer,
24,"N Dukhan, M Al",50,2012,[PDF] academia.edu,International Journal of Thermal Sciences,"N Dukhan, M Ali - International Journal of Thermal Sciences, 2012 - Elsevier","In applications where a fluid flows through the open pores of metal foam, the foam is treated as an infinite porous medium for which the Darcy law and the Forchheimer equation are applied, in order to describe the pressure drop and to obtain the permeability and form drag",Strong wall and transverse size effects on pressure drop of flow through open-cell metal foam,International Journal of Thermal Sciences,N Dukhan
25,"S Kim, CW Le",36,2014,[PDF] sciencedirect.com,Procedia Materials Science,"S Kim, CW Lee - Procedia Materials Science, 2014 - Elsevier","The present paper introduces the manufacturing process and industrial applications of Alantum metal foams having a complete open-pore structure. Wide spectrum of foam products, based on several distinguished properties of metal foams is described. Examples",A review on manufacturing and application of open-cell metal foam,Procedia Materials Science,S Kim
26,"CY Zhao, TJ Lu, HP Hodso",194,2004,No,International Journal of Heat and Mass …,"CY Zhao, TJ Lu, HP Hodson - International Journal of Heat and Mass …, 2004 - Elsevier","… radiation mechanisms in open-celled cellular metal foams. The metal foam will be considered
as a semi-transparent medium capable of absorbing, emitting and scattering thermal radiation.
The spectral transmittance and reflectance of FeCrAlY foams with different cell sizes but …",Thermal radiation in ultralight metal foams with open cells,International Journal of Heat and Mass …,CY Zhao
27,"N Dukhan, K Pate",43,2011,No,Journal of Porous Materials,"N Dukhan, K Patel - Journal of Porous Materials, 2011 - Springer","Many applications require fluid flow through the open pores of metal foam. The foam is usually treated as a porous medium for which the Darcy law and the Hazen-Dupuit-Darcy (or Forchheimer) equation are used to describe the pressure drop, and for obtaining the two",Effect of sample's length on flow properties of open-cell metal foam and pressure-drop correlations,Journal of Porous Materials,N Dukhan
28,"KI Salas, AM Waa",57,2007,[PDF] researchgate.net,Journal of heat transfer,"KI Salas, AM Waas - Journal of heat transfer, 2007 - … .asmedigitalcollection.asme.org",Convective heat transfer in aluminum metal foam sandwich panels is investigated with potential applications to actively cooled thermal protection systems in hypersonic and re-entry vehicles. The size effects of the metal foam core are experimentally investigated and,Convective heat transfer in open cell metal foams,Journal of heat transfer,KI Salas
29,"N Dukhan, Ö Bağcı, M Özdemi",40,2015,No,International Journal of Heat and Mass …,"N Dukhan, Ö Bağcı, M Özdemir - International Journal of Heat and Mass …, 2015 - Elsevier","Experimental heat transfer results for a commercial open-cell aluminum foam cylinder heated at the wall by a constant heat flux and cooled by water flow, are presented. The results cover thermal-entry and fully-developed regions. Measurements include wall",Thermal development in open-cell metal foam: an experiment with constant wall heat flux,International Journal of Heat and Mass …,N Dukhan
30,"EA Friis, RS Lakes, JB Par",346,1988,[PDF] wisc.edu,Journal of Materials Science,"EA Friis, RS Lakes, JB Park - Journal of Materials Science, 1988 - Springer","… 2, 3] that man-made foams, even if closed cell in nature, often behave as an open-cell foam … 9
shows a sample in a strained state: many of the cell walls have been torn or … for thermo- setting
polymer foams; and sequential plastic com- pression in three directions for metal foams …",Negative Poisson's ratio polymeric and metallic foams,Journal of Materials Science,EA Friis
31,"XH Yang, JX Bai, HB Yan, JJ Kuang, TJ Lu",34,2014,[PDF] researchgate.net,Transport in porous …,"XH Yang, JX Bai, HB Yan, JJ Kuang, TJ Lu… - Transport in porous …, 2014 - Springer","We present an analytical model for the effective thermal conductivity of fluid-saturated metal foams with open cells. For high porosity ranges (ε ≥ 0.9)(ε≥ 0.9), the model is derived based on a realistic representative unit cell (a tetrakaidecahedron with cuboid node) under",An analytical unit cell model for the effective thermal conductivity of high porosity open-cell metal foams,Transport in porous …,XH Yang
32,"LE Murr, SM Gaytan, F Medina, E Martinez",209,2010,No,Materials Science and …,"LE Murr, SM Gaytan, F Medina, E Martinez… - Materials Science and …, 2010 - Elsevier","… With the exception of the most dense solid and open (or hollow) cell structures, the experimental
hollow cellular foams in Table 1 have relative densities equal to or less than 0.3, consistent with
most of the other reported metal and alloy foams, especially aluminum and …",Characterization of Ti–6Al–4V open cellular foams fabricated by additive manufacturing using electron beam melting,Materials Science and …,LE Murr
33,"EM Castrodeza, C Mapelli, M Vedani",32,2009,No,Journal of materials …,"EM Castrodeza, C Mapelli, M Vedani… - Journal of materials …, 2009 - Springer","Foams and other highly porous materials with a cellular structure are known to have many interesting combinations of physical and mechanical properties. In addition, foaming of shape memory alloys (SMA) greatly improves the set of application possibilities. In this work",Processing of shape memory CuZnAl open-cell foam by molten metal infiltration,Journal of materials …,EM Castrodeza
34,"Z Wang, H Ma, L Zhao, G Yan",111,2006,No,Scripta Materialia,"Z Wang, H Ma, L Zhao, G Yang - Scripta Materialia, 2006 - Elsevier","… Metal foams, as a new class of engineering materials, have potential for absorbing energy for …
to the difficulty of characterizing the high strain rate behavior of aluminum alloy foams. Kenny
[2] reported that the specific energy absorption of Alcan foam (open-cell) was independent …",Studies on the dynamic compressive properties of open-cell aluminum alloy foams,Scripta Materialia,Z Wang
35,"M Wicklein, K Thom",72,2005,No,Materials Science and Engineering: A,"M Wicklein, K Thoma - Materials Science and Engineering: A, 2005 - Elsevier","… The elastic and plastic properties of an open-cell aluminium foam have been determined by … J.
Banhart, MF Ashby, NA Fleck (Eds.), Cellular Metals and Metal Foaming Technology, MIT … J.
Banhart. J. Banhart, H. Eifert (Eds.), Fraunhofer USA Metal Foam Symposium—Symposium …",Numerical investigations of the elastic and plastic behaviour of an open-cell aluminium foam,Materials Science and Engineering: A,M Wicklein
36,"H Liu, J Wei, Z Q",21,2012,[PDF] xjtu.edu.cn,Journal of Sound and Vibration,"H Liu, J Wei, Z Qu - Journal of Sound and Vibration, 2012 - Elsevier","As the speed of high-speed train (HST) increases continuously, aerodynamic noise has become more remarkable compared with the wheel/rail noise, which affects the inhabited environment along the railway and the riding comfort. This paper preliminarily investigates",Prediction of aerodynamic noise reduction by using open-cell metal foam,Journal of Sound and Vibration,H Liu
37,"S De Schampheleire, P De Jaeger, K De Kerpel",23,2016,[PDF] mdpi.com,Materials,"S De Schampheleire, P De Jaeger, K De Kerpel… - Materials, 2016 - mdpi.com","This paper reviews the available methods to study thermal applications with open-cell metal foam. Both experimental and numerical work are discussed. For experimental research, the focus of this review is on the repeatability of the results. This is a major concern, as most",How to study thermal applications of open-cell metal foam: Experiments and computational fluid dynamics,Materials,S De Schampheleire
38,"N Michailidis, F Stergioudi, H Omar, DN Tsipa",69,2010,[PDF] academia.edu,Mechanics of Materials,"N Michailidis, F Stergioudi, H Omar, DN Tsipas - Mechanics of Materials, 2010 - Elsevier","… Production of the open-cell Al-foams … The construction of the 3D model of the open-cell Al-foam
was based on a serial sectioning method … The procedure followed to simulate and calculate the
stresses developed during the deformation of the Al metal foam is described in detail in …",An image-based reconstruction of the 3D geometry of an Al open-cell foam and FEM modeling of the material response,Mechanics of Materials,N Michailidis
39,"DJ Sypeck, HNG Wadle",204,2002,[PDF] virginia.edu,Advanced Engineering Materials,"DJ Sypeck, HNG Wadley - Advanced Engineering Materials, 2002 - Wiley Online Library","… Nonetheless, the relative properties of the tetrahedral truss core significantly exceed stochastic
foam systems, are … Sypeck, Wadley/Cellular Metal Truss Core Sandwich Structures close to model
predictions and show much promise as an open cell counterpart to honeycomb …",Cellular metal truss core sandwich structures,Advanced Engineering Materials,DJ Sypeck
40,"N Jha, DP Mondal, JD Majumdar, A Badkul, AK Jha",99,2013,No,Materials & Design,"N Jha, DP Mondal, JD Majumdar, A Badkul, AK Jha… - Materials & Design, 2013 - Elsevier","… 7]. In recent years, there has been a strong interest in using metal foams, especially Ti … a
temperature above 400 °C. Several methods have been adopted for producing open cell titanium
foams … and hollow sphere sintering [3] resulting in limited porosity (<50%) in the foam body …",Highly porous open cell Ti-foam using NaCl as temporary space holder through powder metallurgy route,Materials & Design,N Jha
41,"K Boomsma, D Poulikako",309,2002,[PDF] psu.edu,Journal of …,"K Boomsma, D Poulikakos - Journal of …, 2002 - … .asmedigitalcollection.asme.org","… Reviewing the pressure-drop data from both the compressed and uncompressed foams, it
becomes apparent that the flow through open-cell metal foams deviates from Darcy law flow be-
havior, ie, the pressure-drop across the foam is a quadratic func- tion of the flow velocity …",The effects of compression and pore size variations on the liquid flow characteristics in metal foams,Journal of …,K Boomsma
42,"S Mellouli, H Dhaou, F Askri, A Jemni",93,2009,No,International Journal of …,"S Mellouli, H Dhaou, F Askri, A Jemni… - International Journal of …, 2009 - Elsevier","… Fig. 7. (a) Aluminium open-cell foams, (b, c) typical pore structure of open-cell metal foam and
(d) ligament cross sections, taken from [21], [22]. Duocel Aluminium foam from ERG Materials
and Aerospace Corporation [21] is press-fitted inside the different cases of MHTs …",Hydrogen storage in metal hydride tanks equipped with metal foam heat exchanger,International Journal of …,S Mellouli
43,N Dukha,100,2013,No,201,N Dukhan - 2013 - books.google.com,"… Open-cell foams are highly permeable with a substantial surface area density (up to 5600
m2/m3) … The near future will very likely see more test standards (some international) for foams
and foam-based struc … New large-scale and serial applications of metal foams are anticipated …",[BOOK][B] Metal foams: fundamentals and applications,,
44,"S Yu, J Liu, M Wei, Y Luo, X Zhu, Y Li",48,2009,No,Materials & Design,"S Yu, J Liu, M Wei, Y Luo, X Zhu, Y Liu - Materials & Design, 2009 - Elsevier","… 5. Energy absorption capacity of open-cell ZA22 foams … of metallic foams is mainly due to cells
yielding, buckling, fracture, and the friction between cell walls when … provide more friction source
during the collapse course because of higher volume fraction of matrix metal in the …",Compressive property and energy absorption characteristic of open-cell ZA22 foams,Materials & Design,S Yu
45,"HNG Wadley, NA Fleck, AG Evan",734,2003,[PDF] psu.edu,Composites Science and Technology,"HNG Wadley, NA Fleck, AG Evans - Composites Science and Technology, 2003 - Elsevier","… 1. Introduction. Numerous techniques have been developed for synthesizing inexpensive metal
foams with stochastic, closed cells [1], [2]. Other processes have been devised for manufacturing
open cell, stochastic structures [3], [4], [5], [6], [7], [8], [9], [10] …",Fabrication and structural performance of periodic cellular metal sandwich structures,Composites Science and Technology,HNG Wadley
